,Title,Published_date,Views,Likes,Comments,Month
377,Live Coding Register Form - Part 4 of Code Ponder,2018-11-23,977,15,2,Nov
378,Live Coding Next.js Typescript Setup - Part 3 of Code Ponder,2018-11-22,1879,40,6,Nov
379,What I Learned Attempting to Code a Startup in 24 hours,2018-11-21,6784,214,72,Nov
380,Live Coding Login - Part 2 of Code Ponder,2018-11-21,1219,17,6,Nov
381,Live Coding Register a User - Part 1 of Code Ponder,2018-11-20,1994,45,9,Nov
382,Live Coding the GraphQL Server - Part 0 of Code Ponder,2018-11-19,6934,104,32,Nov
383,Coding a Startup in 24 hours *LIVE NOW*,2018-11-17,3126,108,12,Nov
384,How to test React and Apollo code with MockedProvider,2018-11-16,4004,54,9,Nov
385,How I test my GraphQL Resolvers,2018-11-15,15154,211,49,Nov
386,Evaluating Hasura,2018-11-14,16849,264,71,Nov
387,Checking out PostGraphile,2018-11-13,8301,149,45,Nov
388,AWS AppSync Alternatives,2018-11-12,3999,60,28,Nov
389,My Thoughts on Custom Resolvers in AppSync - Part 6,2018-11-11,6117,75,56,Nov
390,AppSync Authentication with Cognito User Pools - Part 5,2018-11-10,6106,55,24,Nov
391,GraphQL Subscriptions with Apollo and AppSync - Part 4,2018-11-09,3847,59,6,Nov
392,Apollo Optimistic UI with AppSync - Part 3,2018-11-08,2680,42,16,Nov
393,Querying AppSync and using CSS Grid - Part 2,2018-11-07,2228,43,18,Nov
394,GraphQL Mutation with Apollo and AppSync Client - Part 1,2018-11-06,5637,59,28,Nov
395,I'll be at GraphQL Summit this week,2018-11-05,752,36,23,Nov
396,AWS AppSync Setup with Amplify - Part 0,2018-11-04,6331,107,22,Nov
397,AWS AppSync Series Introduction,2018-11-03,6871,131,34,Nov
398,New VSCode Extension to Refactor React Code,2018-11-02,5723,204,19,Nov
399,React Hooks useContext,2018-11-01,19247,251,62,Nov
400,Using Immer with Reducers and React Hooks,2018-10-31,18184,502,51,Oct
401,Using React Hooks vs. Class Components,2018-10-30,22329,258,40,Oct
402,Are React Hooks Slower than Class Components?,2018-10-29,20101,383,106,Oct
403,Fetching Data from an API with React Hooks useEffect,2018-10-28,94482,1964,129,Oct
404,Building a Todo List with React Hooks useState,2018-10-27,38081,700,70,Oct
405,My Thoughts on React Hooks,2018-10-26,27121,503,85,Oct
406,Generating Typescript Types for GraphQL Resolvers with graphqlgen,2018-10-25,7197,136,31,Oct
407,Docker Compose Tutorial with PostgreSQL and Node.js,2018-10-24,58785,1031,48,Oct
408,Docker PostgreSQL Tutorial with Persistent Data,2018-10-23,33591,528,34,Oct
409,Docker Multi-Stage Build Tutorial with Typescript,2018-10-22,11637,207,15,Oct
410,Docker Build Typescript Node.js Server,2018-10-21,17699,441,24,Oct
411,Argon2 Password Hashing Node.js | BCrypt Alternative,2018-10-20,5316,106,23,Oct
412,AWS Cognito Authentication Component,2018-10-19,3206,55,20,Oct
413,AWS AppSync with Apollo GraphQL,2018-10-18,6241,105,33,Oct
414,AWS AppSync Tutorial with React,2018-10-17,20796,256,49,Oct
415,Elasticsearch Autocomplete Demo,2018-10-16,22953,363,58,Oct
416,Building a Better Grocery List | The Saffron Podcast Ep 8,2018-10-15,819,13,2,Oct
417,JWT vs Cookies for Authentication,2018-10-14,57648,1340,73,Oct
418,Why I no Longer use Redux with React,2018-10-13,196984,3664,376,Oct
419,Apollo Rest DataSource,2018-10-12,6984,154,32,Oct
420,Stripe GraphQL Series Conclusion,2018-10-11,1759,35,38,Oct
421,Styled Components Typescript React Example - Part 8,2018-10-10,14405,169,18,Oct
422,Stripe Cancel Subscription - Part 7,2018-10-09,3982,52,10,Oct
423,React Native App | The Saffron Podcast Ep 7,2018-10-08,906,16,7,Oct
424,Update Credit Card Stripe - Part 6,2018-10-08,4451,36,12,Oct
425,Navbar with React Router and Apollo - Part 5,2018-10-07,2489,42,20,Oct
426,Displaying Different Data for Paid Users in React - Part 4,2018-10-06,2848,59,1,Oct
427,Creating a Customer in Stripe with React and GraphQL - Part 3,2018-10-05,9136,127,44,Oct
428,Register and Login Page in React with GraphQL - Part 2,2018-10-04,12702,162,39,Oct
429,Typescript GraphQL Server from Scratch with Authentication - Part 1,2018-10-03,21936,324,62,Oct
430,How Stripe works in a Fullstack Project - Part 0,2018-10-02,8792,183,16,Oct
431,Stripe GraphQL Series Introduction,2018-10-01,11840,192,41,Oct
432,Why I'm not using Server-Side Rendering (SSR),2018-09-30,6967,134,75,Sep
433,How I Deploy my Code,2018-09-29,9933,295,29,Sep
434,Tech Stack used to Develop my Side Project,2018-09-28,28358,872,122,Sep
435,Practical React Conclusion,2018-09-27,4832,214,52,Sep
436,Deploying Create React App to Surge and Netlify - Part 16,2018-09-26,10096,257,21,Sep
437,Coding a Todo List in React.js - Part 15,2018-09-25,58433,778,91,Sep
438,Saffron is Live! | The Saffron Podcast Ep 6,2018-09-24,521,15,7,Sep
439,Lifting State Up React.js - Part 14,2018-09-24,28287,664,45,Sep
440,Rendering Arrays in React.js - Part 13,2018-09-23,61735,827,53,Sep
441,Fetch Data from an API in React.js - Part 12,2018-09-22,253756,3444,231,Sep
442,Form Validation in React.js - Part 11,2018-09-21,147133,1597,85,Sep
443,Optimizing a React.js Form - Part 10,2018-09-20,15807,339,30,Sep
444,Form Components in React.js - Part 9,2018-09-19,30660,488,26,Sep
445,Component Lifecycle in React.js - Part 8,2018-09-18,14823,262,13,Sep
446,Designing a Landing Page | The Saffron Podcast Ep 5,2018-09-17,800,15,5,Sep
447,How to Conditionally Render Components in React.js - Part 7,2018-09-17,51539,690,37,Sep
448,How setState works in React.js - Part 6,2018-09-16,43557,610,44,Sep
449,State in React.js - Part 5,2018-09-15,24237,478,42,Sep
450,Importing Components in React.js - Part 4,2018-09-14,48340,626,31,Sep
451,Passing Data to Components in React.js - Part 3,2018-09-13,65625,906,46,Sep
452,How to Create React.js Components - Part 2,2018-09-12,41532,578,32,Sep
453,How to Install React.js on your Computer - Part 1,2018-09-11,123897,1272,83,Sep
454,Pricing | The Saffron Podcast Ep 4,2018-09-10,696,16,10,Sep
455,React.js Beginner Series Introduction,2018-09-10,55754,701,30,Sep
456,How to Handle Dates in GraphQL,2018-09-09,15139,124,18,Sep
457,How to run the Airbnb Clone on your Computer,2018-09-08,15443,78,15,Sep
458,Upgrading Airbnb Clone to Typescript 3,2018-09-07,4594,20,8,Sep
459,Airbnb Clone Conclusion | What's Next?,2018-09-06,10359,86,62,Sep
460,React Native Tab Bar - Part 78,2018-09-05,12426,65,2,Sep
461,React Native Pagination with Apollo - Part 77,2018-09-04,4839,33,21,Sep
462,Refactoring the UI | The Saffron Podcast Ep 3,2018-09-03,904,18,7,Sep
463,Rendering Cards using React Native FlatList - Part 76,2018-09-03,6174,28,4,Sep
464,Search Query in React Native - Part 75,2018-09-02,2378,23,2,Sep
465,Typeorm GraphQL Search Query - Part 74,2018-09-01,5957,70,8,Sep
466,Adding Mock Data to PostgreSQL -  Part 73,2018-08-31,2407,30,0,Aug
467,Fixing Netlify Build Failures - Part 72,2018-08-30,3163,18,21,Aug
468,Updating the Cache after a Listing is Updated - Part 71,2018-08-29,1449,27,8,Aug
469,How much faster is the Redis Query vs the PostgreSQL Query - Part 70,2018-08-28,18229,226,17,Aug
470,Deciding on a MVP | The Saffron Podcast Ep 2,2018-08-27,1170,26,3,Aug
471,Cache GraphQL Resolver with Redis - Part 69,2018-08-27,8586,118,30,Aug
472,Finish Update Listing Form and Mutation - Part 68,2018-08-26,1617,22,23,Aug
473,Update Listing Form - Part 67,2018-08-25,1915,17,2,Aug
474,Update Listing Mutation - Part 66,2018-08-24,1090,16,1,Aug
475,Introduction to Saffron | The Saffron Podcast Ep 1,2018-08-23,4969,119,40,Aug
476,Deploy to Heroku with GitHub Integration - Part 65,2018-08-23,6620,48,34,Aug
477,Netlify Continuous Deployment with Yarn Workspaces - Part 64,2018-08-22,4027,36,14,Aug
478,React Google Maps - Part 63,2018-08-21,22700,199,24,Aug
479,React Geosuggest - Part 62,2018-08-20,4197,62,20,Aug
480,Trying Load testing on Airbnb Clone with Locust,2018-08-19,7115,157,33,Aug
481,My Development Environment,2018-08-18,41726,933,45,Aug
482,The Cost of Serverless,2018-08-17,9975,242,33,Aug
483,How I would Scale My Backend Infrastructure,2018-08-16,3135,93,11,Aug
484,My Deployment Tech Stack,2018-08-15,5233,177,40,Aug
485,Taking Feature Requests for Airbnb Clone | Come Vote!,2018-08-14,645,24,56,Aug
486,Real Time Messages with React Apollo Subscriptions - Part 61,2018-08-13,2499,35,21,Aug
487,Create Messages with React Apollo Mutation Component - Part 60,2018-08-12,1741,14,2,Aug
488,Fetch Messages with React Apollo Query Component - Part 59,2018-08-11,1536,22,3,Aug
489,Refactoring to use React Apollo Query Component - Part 58,2018-08-10,1063,22,14,Aug
490,Dynamic React Router Pages with GraphQL - Part 57,2018-08-09,1902,29,2,Aug
491,GraphQL Subscriptions in React with Apollo - Part 56,2018-08-08,4367,38,9,Aug
492,Filtering GraphQL Subscriptions - Part 55,2018-08-07,4567,49,19,Aug
493,GraphQL Subscriptions with GraphQL Yoga - Part 54,2018-08-06,4799,56,15,Aug
494,Create and View Messages in GraphQL - Part 53,2018-08-05,1445,29,8,Aug
495,Displaying Cards from React Native Elements  - Part 52,2018-08-04,6980,46,11,Aug
496,GraphQL Image Uploads in React Native - Part 51,2018-08-03,3192,43,34,Aug
497,Checkbox Group Form Field React Native - Part 50,2018-08-02,8716,58,7,Aug
498,Create Listing Form in React Native - Part 49,2018-08-01,1168,13,6,Aug
499,Cookies in React Native - Part 48,2018-07-31,7396,53,8,Jul
500,Logout in React with GraphQL - Part 47,2018-07-30,1777,28,10,Jul
501,Clearing Apollo Cache after Login - Part 46,2018-07-29,3838,42,8,Jul
502,Batching and Caching GraphQL Requests with DataLoader - Part 45,2018-07-28,16625,267,54,Jul
503,Fetching the User for each Listing - Part 44,2018-07-27,1355,21,13,Jul
504,Serve Images using Express - Part 43,2018-07-26,5253,59,17,Jul
505,Show Listings using Ant Design Cards - Part 42,2018-07-25,5974,43,7,Jul
506,Uploading an Image in React with GraphQL - Part 41,2018-07-24,12494,86,23,Jul
507,File Upload GraphQL Yoga - Part 40,2018-07-23,6662,66,25,Jul
508,Redirect Correctly after Login - Part 39,2018-07-22,20228,157,18,Jul
509,Create Listing GraphQL Higher Order Component - Part 38,2018-07-21,1709,32,15,Jul
510,Custom Formik Fields and Fix Typescript Imports - Part 37,2018-07-20,5924,60,15,Jul
511,Multi Step Form in React with Formik - Part 36,2018-07-19,30356,177,25,Jul
512,AuthRoute Questions - Part 35,2018-07-18,1053,20,11,Jul
513,React Router Authorization - Part 34,2018-07-17,9748,89,34,Jul
514,GraphQL Middleware - Part 33,2018-07-16,2577,43,13,Jul
515,GraphQL Resolver Authorization - Part 32,2018-07-15,3530,46,7,Jul
516,Create Listing Resolver - Part 31,2018-07-14,2064,28,12,Jul
517,How to do Database Migrations with TypeORM - Part 30,2018-07-13,9835,116,14,Jul
518,Adding a Listing Database Table - Part 29,2018-07-12,1894,25,26,Jul
519,Fixing Change Password - Part 28,2018-07-11,895,19,20,Jul
520,Generic React Text Component for Confirmation Pages - Part 27,2018-07-10,1400,23,20,Jul
521,Change Password - Part 26,2018-07-09,1587,31,3,Jul
522,Forgot Password Controller - Part 25,2018-07-08,1819,20,12,Jul
523,Forgot Password Form - Part 24,2018-07-07,3432,38,3,Jul
524,Sending Test Emails with Nodemailer - Part 23,2018-07-06,5050,65,9,Jul
525,How to deploy Prisma to Heroku,2018-07-05,4157,62,30,Jul
526,Saving Session Id in React Native with Secure Storage  - Part 22,2018-07-05,8526,63,17,Jul
527,React Native Login Screen - Part 21,2018-07-04,2712,19,3,Jul
528,React Login Page - Part 20,2018-07-03,7069,58,12,Jul
529,Generating Typescript Types with Apollo CLI - Part 19,2018-07-02,3686,52,28,Jul
530,Styling React Native Register Form - Part 18,2018-07-01,2965,36,19,Jul
531,How to use Formik with React Native - Part 17,2018-06-30,5934,46,8,Jun
532,Adding GraphQL and Routing to React Native - Part 16,2018-06-29,3096,34,19,Jun
533,Setting up React Native with Expo - Part 15,2018-06-28,10117,65,30,Jun
534,Deploying a React App with Netlify - Part 14,2018-06-27,10920,105,49,Jun
535,Deploying a Typescript Server to Heroku with Docker - Part 13,2018-06-26,9129,100,42,Jun
536,Automating Dokku Deployment and Lerna - Part 12,2018-06-25,4361,68,13,Jun
537,Deploying a Typescript Server to Digital Ocean with Dokku - Part 11,2018-06-24,16296,227,37,Jun
538,How to put a Yarn Workspace in a Docker Image - Part 10,2018-06-23,9514,129,49,Jun
539,Generating Typescript Types with Apollo Codegen - Part 9,2018-06-22,8555,76,32,Jun
540,Calling the Register Mutation - Part 8,2018-06-21,4338,69,63,Jun
541,Adding a Controller Package to share code between React and React Native - Part 7,2018-06-20,5748,73,52,Jun
542,Simplifying a React form with the Formik Field Component - Part 6,2018-06-19,9433,95,17,Jun
543,Sharing Validation code between the React Web App and GraphQL Server - Part 5,2018-06-18,6356,98,34,Jun
544,Form Validation in Formik with Yup - Part 4,2018-06-17,20904,174,17,Jun
545,Coding React Form with Formik and Ant Design - Part 3,2018-06-16,38962,326,40,Jun
546,Adding React Apollo and React Router - Part 2,2018-06-15,12883,121,28,Jun
547,"Setting up the Yarn Workspace, Server, and Website - Part 1",2018-06-14,24988,235,135,Jun
548,Tips to be successful in this series - Part 0,2018-06-13,24768,319,34,Jun
549,"Fullstack Airbnb Clone with GraphQL, React, and React Native",2018-06-12,92338,1057,165,Jun
550,I made a GraphQL Middleware Library,2018-06-11,1118,44,16,Jun
551,Yarn workspace with Typescript React Native app,2018-06-10,3453,39,11,Jun
552,How to setup a Yarn workspace with Typescript,2018-06-09,16235,293,36,Jun
553,How to setup a Typescript React Native App,2018-06-08,9183,93,15,Jun
554,Yarn workspace with React and React Native,2018-06-07,16473,157,23,Jun
555,Yarn Workspaces Tutorial,2018-06-06,42238,993,77,Jun
556,I'm looking for app ideas to code,2018-06-05,2618,63,142,Jun
557,Removing the Race Conditions from the Tests - Part 30,2018-06-04,1690,25,20,Jun
558,How to use Apollo Rendered Props with Typescript,2018-06-03,2390,47,23,Jun
559,Merging a Modular GraphQL Schema - Part 29,2018-06-02,3678,62,35,Jun
560,Recommended Chrome Extensions for React.js Developers,2018-06-01,3720,80,23,Jun
561,What I learned as a Computer Science Student,2018-05-30,63354,1917,127,May
562,Prisma and Heroku,2018-05-30,1247,23,12,May
563,1 to 1 Associations in Prisma,2018-05-29,1663,49,29,May
564,Getting the Jest tests to run in Parallel - Part 28,2018-05-28,2527,42,21,May
565,My Patreon is Live!,2018-05-27,336,15,1,May
566,How to Deploy Prisma to Digital Ocean Server,2018-05-26,3406,102,31,May
567,How to use SQL with Prisma,2018-05-25,2999,52,12,May
568,How to use Prisma with an existing PostgreSQL Database,2018-05-24,3762,40,10,May
569,How to use a Local PostgreSQL Database with Prisma,2018-05-23,8868,123,34,May
570,GraphQL Typescript Server Conclusion,2018-05-22,1396,52,18,May
571,OAuth Demo with React - Part 27,2018-05-21,4936,60,8,May
572,Twitter OAuth - Part 26,2018-05-20,7518,115,20,May
573,Rate Limiting - Part 25,2018-05-19,5086,83,20,May
574,GraphQL Forgot Password Implementation - Part 24,2018-05-18,2445,42,12,May
575,Lock User Account GraphQL - Part 23,2018-05-17,1015,35,7,May
576,Forgot Password Test Case - Part 22,2018-05-16,2580,36,9,May
577,Logout of Multiple Sessions - Part 21,2018-05-15,1258,46,29,May
578,Building a GraphQL Server Test Client - Part 20,2018-05-14,1349,48,14,May
579,Simple Logout with GraphQL - Part 19,2018-05-13,1879,36,8,May
580,Logging or Authentication GraphQL Middleware - Part 18,2018-05-12,2831,44,14,May
581,Running Jest Tests Sequentially - Part 17,2018-05-11,2580,40,18,May
582,GraphQL Middleware - Part 16,2018-05-10,3502,67,65,May
583,Express Session for Login - Part 15,2018-05-09,10366,120,42,May
584,GraphQL Login Mutation - Part 14,2018-05-08,3534,59,23,May
585,Send Confirmation Email with SparkPost - Part 13,2018-05-07,2512,67,43,May
586,Fixing Connection Error - Part 12,2018-05-06,2022,54,30,May
587,Testing Redis Email Link - Part 11,2018-05-05,2529,48,33,May
588,Jest Global Setup - Part 10,2018-05-04,5791,79,50,May
589,Email Confirmation Link with Redis - Part 9,2018-05-03,4390,94,34,May
590,GraphQL Validating Input - Part 8,2018-05-02,6541,102,28,May
591,Handling Errors in GraphQL - Part 7,2018-05-01,6119,108,13,May
592,GraphQL Schema Stitching - Part 6,2018-04-30,8760,122,43,Apr
593,Getting GraphQL Yoga and Jest to work together - Part 5,2018-04-29,6609,88,31,Apr
594,Setting up a Test Database with TypeORM - Part 4,2018-04-28,14557,179,39,Apr
595,Setting up Jest - Part 3,2018-04-27,15339,190,52,Apr
596,Creating a User into with TypeORM - Part 2,2018-04-26,11478,157,47,Apr
597,Creating a TypeORM Entity - Part 1,2018-04-25,23098,262,65,Apr
598,Setting up a TypeORM Project - Part 0,2018-04-24,32924,348,95,Apr
599,GraphQL Typescript Server Boilerplate  - Introduction,2018-04-23,27490,325,51,Apr
600,Jest snapshot testing with Storybook,2018-04-22,6289,52,8,Apr
601,React Router Native - Passing Data,2018-04-21,7215,76,29,Apr
602,React Router Native Tutorial,2018-04-20,13944,277,39,Apr
603,Using Typescript in React,2018-04-19,54679,753,84,Apr
604,Typescript tsconfig tutorial,2018-04-18,14919,312,17,Apr
605,Typescript Basics,2018-04-17,24600,675,28,Apr
606,Upload Files to a GraphQL Server using Apollo Upload,2018-04-16,18344,192,54,Apr
607,My TSLint Configuration,2018-04-15,8177,100,18,Apr
608,GraphQL PHP Server,2018-04-14,19675,159,37,Apr
609,CodeSandbox Tutorial,2018-04-14,34004,267,27,Apr
610,Why I like Typescript,2018-04-13,3323,105,34,Apr
611,Apollo Boost not setting Cookie,2018-04-11,2157,23,14,Apr
612,Couldn't get cookies working with Slack clone,2018-04-10,583,15,8,Apr
613,How to use Cookies and Sessions in Prisma instead of JWT tokens,2018-04-09,2500,64,58,Apr
614,How to use Express Session with a GraphQL Server,2018-04-08,4925,94,26,Apr
615,How to handle cookies in GraphQL,2018-04-07,4166,48,16,Apr
616,How to set cookies with GraphQL,2018-04-06,17090,141,18,Apr
617,Apollo Loading screen with Query Component,2018-04-05,1859,28,7,Apr
618,Loading screens with Apollo and Recompose,2018-04-04,911,34,21,Apr
619,React 16.3 Context API,2018-04-03,2546,87,50,Apr
620,Redux Form Field Array and Material UI Table Example,2018-04-02,10999,110,23,Apr
621,Typeorm Migrations,2018-04-01,24321,325,40,Apr
622,React 16.3 Forward Refs,2018-03-31,11404,235,40,Mar
623,How to Logout users with React Apollo and GraphQL,2018-03-30,2906,50,48,Mar
624,React Apollo Subscription Component,2018-03-29,7522,98,38,Mar
625,React Apollo New Rendered Props Components,2018-03-28,4082,46,19,Mar
626,Fetching data from an API in GraphQL,2018-03-27,41832,478,55,Mar
627,GraphQL Resolvers,2018-03-26,5635,106,12,Mar
628,What is GraphQL,2018-03-22,2845,149,24,Mar
629,"Setting up Storybook with React, TypeScript and Emotion",2018-03-21,9731,103,23,Mar
630,Invalidating sessions across multiple devices,2018-03-20,893,21,20,Mar
631,Traefik a Reverse Proxy alternative to Nginx,2018-03-19,26221,229,37,Mar
632,Using a Dashboard for Docker instead of the CLI,2018-03-18,3106,54,7,Mar
633,Typescript Types for GraphQL Resolvers,2018-03-17,2231,34,12,Mar
634,Backblaze vs S3,2018-03-16,2266,45,38,Mar
635,How to use Apollo Codegen with React,2018-03-15,3251,40,20,Mar
636,Apollo Codegen,2018-03-14,2405,33,9,Mar
637,Where to store JWT tokens and Session Ids on React Native,2018-03-13,12480,96,8,Mar
638,How Sessions work in Web Servers,2018-03-12,43989,607,32,Mar
639,How to get Create React App to work with Typescript and Emotion,2018-03-11,2512,41,10,Mar
640,Testing npm modules locally,2018-03-10,6770,76,6,Mar
641,Updating Picache to Cache Local Images in React Native,2018-03-09,823,14,5,Mar
642,Why I stopped using LocalStorage,2018-03-08,5331,126,40,Mar
643,Many to Many Entities in Typeorm,2018-03-07,9406,123,34,Mar
644,One to One Relations in Typeorm,2018-03-06,14782,126,11,Mar
645,CRUD in Typeorm,2018-03-05,14022,120,25,Mar
646,How to setup Typeorm,2018-03-04,19855,227,27,Mar
647,Setting up Typescript GraphQL server,2018-03-03,7461,77,22,Mar
648,How to create a Typescript npm module,2018-03-02,12375,117,14,Mar
649,Caching Images in React Native using Typescript,2018-03-01,1796,17,16,Mar
650,Caching Images in React Native,2018-02-28,23842,354,45,Feb
651,Code Splitting in React,2018-02-27,8065,178,21,Feb
652,Apollo Link State Example (with Apollo Boost),2018-02-26,4610,63,19,Feb
653,Apollo Boost,2018-02-25,1612,40,8,Feb
654,Urql - a new GraphQL Client,2018-02-24,3930,81,13,Feb
655,React Fragments,2018-02-23,637,49,7,Feb
656,Prisma Series Conclusion,2018-02-22,4133,51,23,Feb
657,Deploying Prisma - Part 22,2018-02-21,4026,20,3,Feb
658,GraphQL Subscriptions with Prisma - Part 21,2018-02-20,3245,29,12,Feb
659,Fixing Pagination - Part 20,2018-02-19,1499,17,7,Feb
660,Infinite Scroll Products List - Part 19,2018-02-18,1904,21,4,Feb
661,Search and Sorting Products - Part 18,2018-02-17,1223,19,7,Feb
662,Adding Permissions to Update Products - Part 17,2018-02-16,748,10,10,Feb
663,Updating Products - Part 16,2018-02-15,851,15,15,Feb
664,Deleting Products - Part 15,2018-02-14,948,16,14,Feb
665,Using AsyncStorage instead of Redux - Part 14,2018-02-13,3066,28,11,Feb
666,Trying to use Apollo Link State instead of Redux - Part 13,2018-02-12,4498,40,13,Feb
667,Conditionally Rendering Buttons and Securing GraphQL Queries - Part 12,2018-02-11,860,8,9,Feb
668,Updating Apollo Cache and Setting up Redux - Part 11,2018-02-10,1832,16,19,Feb
669,Serving Static Files with GraphQL Yoga - Part 10,2018-02-09,3018,33,22,Feb
670,Fetching Products and Rendering them using FlatList - Part 9,2018-02-08,2358,30,16,Feb
671,Passing JWT Token in Header on GraphQL Requests - Part 8,2018-02-07,6544,52,10,Feb
672,Uploading an Image in React Native to a GraphQL server - Part 7,2018-02-06,5636,53,20,Feb
673,React Native Image Picker - Part 6,2018-02-05,13398,78,27,Feb
674,Refreshing JWT Token - Part 5,2018-02-04,7567,57,27,Feb
675,Building Login Screen - Part 4,2018-02-03,2403,40,21,Feb
676,Handling Errors on Sign up Screen - Part 3,2018-02-02,2385,32,15,Feb
677,Building Sign Up Screen - Part 2,2018-02-01,5080,55,61,Feb
678,Setting up React Native and looking into Prisma's Docker container - Part 1,2018-01-31,10827,100,39,Jan
679,Setting up a Prisma GraphQL Server - Part 0,2018-01-30,23249,217,74,Jan
680,React Native and Prisma GraphQL eCommerce Project - Introduction,2018-01-29,24785,209,54,Jan
681,Prisma and React,2018-01-28,2783,39,3,Jan
682,Getting a better understanding of Prisma,2018-01-27,4593,52,22,Jan
683,Trying out Prisma GraphQL,2018-01-26,12789,112,51,Jan
684,My thoughts on PostGraphQL,2018-01-24,1902,43,19,Jan
685,React Pure Component,2018-01-24,3601,178,20,Jan
686,Javascript: Async and Await,2018-01-23,2816,98,19,Jan
687,ES6 tutorial,2018-01-22,3500,105,16,Jan
688,Easy React Performance Trick,2018-01-21,7284,142,20,Jan
689,How I got started Programming,2018-01-20,2836,124,30,Jan
690,React and Parcel Bundler,2018-01-19,2497,68,10,Jan
691,React and Webpack 3,2018-01-18,1736,29,23,Jan
692,Why do I have so many boxes and how long have I been programming?,2018-01-17,2168,87,22,Jan
693,How to use a Reverse Polish Notation Calculator,2018-01-16,6455,43,2,Jan
694,Stack Calculator Conclusion (available on Google Play Store),2018-01-15,1048,13,0,Jan
695,Disable Landscape mode in React Native,2018-01-14,4707,28,5,Jan
696,How to Deploy a React Native app to the Google Play or Apple Store,2018-01-13,41956,340,20,Jan
697,How to Deploy a React Native app to the Expo Store,2018-01-12,5466,50,14,Jan
698,How to do Animations in React Native,2018-01-11,6892,68,18,Jan
699,Testing new webcam and AMA?,2018-01-10,915,22,15,Jan
700,Taking Feature Suggestions for Stack Calculator,2018-01-09,431,14,2,Jan
701,Answering Beginner React.js Questions,2018-01-08,828,31,4,Jan
702,Clearing the Redux Store,2018-01-07,2542,21,3,Jan
703,Implementing Calculator Operations using Redux,2018-01-06,2290,27,4,Jan
704,Changing our Default Redux State,2018-01-05,701,18,5,Jan
705,Setting up Redux,2018-01-04,1657,39,4,Jan
706,How to build a layout in React Native,2018-01-03,4365,49,35,Jan
707,How to Speed Up iOS Emulator for React Native Apps,2018-01-02,6511,47,6,Jan
708,Installing Eslint for React Native,2018-01-01,7704,86,19,Jan
709,Running Create React Native App on Your Phone,2017-12-31,15113,56,16,Dec
710,Adding Search to a React Material UI Table,2017-12-30,29958,261,39,Dec
711,How to Install React Native,2017-12-30,7023,58,19,Dec
712,Stack Calculator - Beginner React Native Project Series,2017-12-29,6614,83,12,Dec
713,Slack Clone Conclusion,2017-12-28,10693,121,37,Dec
714,HTTPS Update,2017-12-27,2589,20,0,Dec
715,Tried to setup HTTPS with Let's Encrypt,2017-12-25,2093,18,2,Dec
716,Automating Docker Deployments with Watchtower,2017-12-24,1889,32,18,Dec
717,More Batching/Caching on The Server with DataLoader,2017-12-23,1344,16,5,Dec
718,Deploying Slack Clone to AWS,2017-12-22,3108,33,15,Dec
719,Deploying Create React App to Surge,2017-12-21,2173,30,9,Dec
720,Deploying to Vultr,2017-12-20,4485,38,10,Dec
721,Sharing Docker Images,2017-12-19,1880,19,6,Dec
722,Serving Static Files with Nginx,2017-12-18,4033,39,4,Dec
723,Nginx Docker,2017-12-17,3655,42,13,Dec
724,Populating PostgreSQL Database in Docker,2017-12-16,2817,37,0,Dec
725,How to Persist PostgreSQL Data in Docker,2017-12-15,7433,83,6,Dec
726,"Docker Compose Node.js, Redis, and PostgreSQL",2017-12-14,18901,288,33,Dec
727,Starting to Setup Docker,2017-12-13,2418,42,7,Dec
728,Babel Build,2017-12-12,1576,33,5,Dec
729,Docker Express.js,2017-12-11,7311,166,18,Dec
730,Fixing Authentication for GraphQL Subscriptions,2017-12-10,1344,22,13,Dec
731,Feature: GraphQL Caching with DataLoader,2017-12-09,2210,27,3,Dec
732,Feature: Infinite Scroll in React,2017-12-08,14664,134,25,Dec
733,Feature: Cursor Pagination with GraphQL,2017-12-07,11335,113,12,Dec
734,Feature: Offset Pagination with GraphQL,2017-12-06,3797,40,4,Dec
735,Feature: GraphQL Subscriptions with Redis PubSub,2017-12-05,4433,74,26,Dec
736,Feature: Group Message part 2,2017-12-04,915,19,8,Dec
737,Feature: Group Message part 1,2017-12-03,994,23,4,Dec
738,Feature: Private Channels part 2,2017-12-02,849,18,5,Dec
739,Feature: Private Channels part 1,2017-12-01,1300,25,3,Dec
