,Title,Published_date,Views,Likes,Comments,Month
740,Feature: File Uploads part 3 - Expressjs Static Files,2017-11-29,1114,31,7,Nov
741,Feature: File Uploads part 2 - Formidable Middleware for Expressjs,2017-11-28,2168,24,8,Nov
742,Cancel Edit in React Material UI Table,2017-11-28,24253,162,12,Nov
743,Feature: File Uploads part 1 - React Dropzone,2017-11-27,11267,91,19,Nov
744,Sorting Columns in React Material UI Table,2017-11-22,23784,211,23,Nov
745,Deleting and Editing rows in React Material UI Table,2017-11-21,50810,436,60,Nov
746,Feature Suggestions for Slack Clone,2017-11-20,1138,28,52,Nov
747,Fixing Bugs in the Frontend,2017-11-19,1188,22,6,Nov
748,Testing a GraphQL Server,2017-11-18,6388,90,35,Nov
749,GraphQL Subscriptions for Direct Messaging,2017-11-17,2095,33,17,Nov
750,Updating Cache after a GraphQL Mutation,2017-11-16,4066,36,6,Nov
751,Listing Users You've Direct Messaged,2017-11-15,1160,28,13,Nov
752,Building a React Autocomplete Component with GraphQL and Downshift,2017-11-14,3065,39,13,Nov
753,Building Resolvers for Direct Messaging,2017-11-13,1258,29,14,Nov
754,Fixing Apollo Client Afterware,2017-11-12,1464,28,9,Nov
755,Sequelize Model for Direct Messaging,2017-11-11,1964,34,6,Nov
756,Trying to Control Access to GraphQL Subscriptions,2017-11-10,1402,28,16,Nov
757,Refactoring a Sequelize Database Model,2017-11-09,1851,32,8,Nov
758,GraphQL Subscriptions Authentication,2017-11-08,2384,41,17,Nov
759,Unsubscribing from GraphQL Subscriptions,2017-11-07,3635,68,28,Nov
760,Real Time Messaging in React with GraphQL Subscriptions,2017-11-06,11598,145,62,Nov
761,GraphQL Subscriptions Setup in React and Express.js,2017-11-05,4230,53,18,Nov
762,Semantic UI React Comment Component,2017-11-04,5815,60,4,Nov
763,Simple React Form with Formik,2017-11-03,8068,68,12,Nov
764,Optimizing Sequelize with Raw Queries,2017-11-02,7668,51,9,Nov
765,Querying a Many to Many Relationship with Sequelize,2017-11-01,11465,68,20,Nov
766,PostgreSQL Transactions with Sequelize,2017-10-31,8575,79,20,Oct
767,Using a PostgreSQL Join Table to Add Users to Teams,2017-10-30,3318,41,20,Oct
768,Sharing Data Across React Components by Lifting A GraphQL Query,2017-10-29,2262,40,21,Oct
769,Updating React Apollo Cache,2017-10-28,4475,51,24,Oct
770,Building an Add Channel Form with Formik,2017-10-27,3986,62,16,Oct
771,Switching Teams with React Router Dynamic Routes,2017-10-26,3201,56,11,Oct
772,Upgrading to Apollo Client 2.0,2017-10-25,3613,55,53,Oct
773,Building Container Component and GraphQL Query,2017-10-24,3363,52,80,Oct
774,Building Slack's Sidebar with Styled Components,2017-10-23,4231,68,1,Oct
775,Adding Props to Sidebar Component,2017-10-22,3795,63,16,Oct
776,Building Slack's Layout with CSS Grid and Styled Components,2017-10-21,7901,83,10,Oct
777,Bad Semantic UI Layout,2017-10-20,3799,37,14,Oct
778,"Protected Routes, Mutations, and Queries with React Router and GraphQL",2017-10-20,5666,81,37,Oct
779,"Sending, Verifying, and Refreshing JWT Tokens in Node.js",2017-10-18,15552,138,63,Oct
780,Refactoring and Handling Invalid Login,2017-10-17,4032,82,27,Oct
781,Login Mutation GraphQL,2017-10-16,10345,134,31,Oct
782,React Login Form with Mobx,2017-10-15,12337,121,44,Oct
783,Handling Register Form Errors in React Using Semantic UI and GraphQL,2017-10-14,8370,106,35,Oct
784,Register Form in React Using Semantic UI and GraphQL,2017-10-13,11553,119,36,Oct
785,Setting Up React with GraphQL,2017-10-12,11106,134,99,Oct
786,Creating GraphQL Schemas and Resolvers using Sequelize,2017-10-11,19695,205,74,Oct
787,PostgreSQL Naming Conventions and GraphQL Schemas,2017-10-10,10538,146,27,Oct
788,Creating PostgreSQL Database Models with Sequelize,2017-10-09,41412,523,119,Oct
789,Setting up GraphQL Server with Node.js,2017-10-08,24140,294,104,Oct
790,Slack Clone Using GraphQL and React - Introduction,2017-10-07,55224,625,79,Oct
791,How to layout a footer in React Native,2017-10-06,9589,49,9,Oct
792,Picking a Cloud Provider: AWS vs GCP vs Azure vs Vultr vs Digital Ocean,2017-10-05,37239,259,94,Oct
793,How to upload an image to S3 using React and GraphQL,2017-10-04,21653,321,103,Oct
794,React Router Native,2017-10-03,5742,51,17,Oct
795,React Native Hackathon Project,2017-10-02,1071,20,17,Oct
796,Handling Errors in GraphQL and React,2017-10-01,5811,64,24,Oct
797,Validation in GraphQL,2017-09-30,3337,37,5,Sep
798,Upload Files in GraphQL Using Apollo Upload,2017-09-29,15319,142,26,Sep
799,How I Use Vim,2017-09-28,9365,219,33,Sep
800,How OAuth Works,2017-09-27,3069,52,8,Sep
801,Unknown Components in React DevTools,2017-09-26,725,14,5,Sep
802,Visual Studio Code Node.js Debugger,2017-09-25,2025,6,18,Sep
803,React Styled Components Tutorial,2017-09-24,54107,1002,64,Sep
804,Sequelize Migration,2017-09-23,25462,353,35,Sep
805,Debugging React with Visual Studio Code,2017-09-22,46188,249,19,Sep
806,Absolute Imports in React,2017-09-21,6338,67,16,Sep
807,React Folder Structure,2017-09-20,6252,85,15,Sep
808,My Updated Development Setup,2017-09-19,1623,19,10,Sep
809,Deploying Create React App with GitHub Pages,2017-09-18,34874,339,37,Sep
810,Different JWT Secret per User,2017-09-17,1369,20,25,Sep
811,Merging OAuth Accounts in Node.js,2017-09-16,425,14,25,Sep
812,Why use a Graph Database?,2017-09-15,1571,26,16,Sep
813,Vim Macros,2017-09-14,2838,82,9,Sep
814,Autocomplete in React using Downshift and GraphQL,2017-09-13,3961,56,14,Sep
815,Why I don't use MongoDB,2017-09-12,29477,314,92,Sep
816,How to Upload Images in GraphQL with React and Cloudinary,2017-09-11,5660,93,32,Sep
817,Confirmation Email with Node.js,2017-09-10,88363,1321,88,Sep
818,How to Send an Email in Node.js,2017-09-09,17015,196,25,Sep
819,How I Would Do Authentication,2017-09-08,654,22,24,Sep
820,Why I Am Using LocalStorage Over Cookies,2017-09-07,2165,35,11,Sep
821,Double Submitted Cookies with React and GraphQL,2017-09-07,1756,25,39,Sep
822,How to Store JWT tokens in Cookies with React and GraphQL,2017-09-06,17479,142,42,Sep
823,Authentication With Refresh Tokens Implementation,2017-09-06,103719,609,99,Sep
824,Different Authentication Methods for Handling JWT Tokens,2017-09-04,761,24,4,Sep
825,Authentication Strategy with Cookies,2017-09-03,747,10,11,Sep
826,Storing JWT tokens localStorage vs. Cookies,2017-09-02,43034,340,60,Sep
827,Build a GraphQL Server with Node.js and Redis,2017-09-01,12859,219,28,Sep
828,Can You Change the Payload of a JWT Token?,2017-08-31,10575,119,24,Aug
829,One Way to Split up a GraphQL Schema,2017-08-30,6822,160,51,Aug
830,Async Mobx,2017-08-30,3817,86,6,Aug
831,Mobx and Create React App,2017-08-29,3686,46,34,Aug
832,Changing My Development Setup,2017-08-28,46786,347,72,Aug
833,Setting Up The Backend for a Poll Web App with Expressjs and GraphQL,2017-08-28,3043,40,3,Aug
834,Don't setState Like This in React,2017-08-27,11576,136,35,Aug
835,Why use Sequelize? - Volume Fixed,2017-08-26,2783,46,1,Aug
836,Why do you need a Database or Server? - Volume Fixed,2017-08-25,634,15,0,Aug
837,How I would structure a fullstack application on AWS - Volume fixed,2017-08-24,1796,38,13,Aug
838,How a fullstack application works - Volume Fixed,2017-08-23,913,31,1,Aug
839,I Figure Out What I Was Doing Wrong With GraphQL Subscriptions,2017-08-22,988,9,0,Aug
840,My Current Tech Stack - Volume Fixed,2017-08-21,1362,24,7,Aug
841,I Get Stuck Setting Up GraphQL Subscriptions,2017-08-21,620,8,6,Aug
842,How I Pick What Programming Language/Framework to Learn,2017-08-20,1159,18,7,Aug
843,I Try to Make an Email Spam Bot,2017-08-20,5640,59,15,Aug
844,Volume is Fixed and I will be Redoing Videos,2017-08-19,161,18,8,Aug
845,Why use Sequelize?,2017-08-18,3780,25,12,Aug
846,How I would structure a fullstack application on AWS,2017-08-17,3434,31,11,Aug
847,How a fullstack application works,2017-08-16,1943,33,5,Aug
848,Why do you need a Database or Server?,2017-08-15,1013,20,11,Aug
849,My Current Tech Stack,2017-08-14,5573,29,23,Aug
850,Reason ML and React - Hello World,2017-08-13,6479,53,31,Aug
851,How to Handle Multiple Sagas in Redux Saga,2017-08-12,15513,214,44,Aug
852,Fetching data from an API using Redux Saga,2017-08-11,79447,565,43,Aug
853,What backend do I use?,2017-08-10,917,23,28,Aug
854,How to add Redux Saga to Create React App,2017-08-10,19127,173,34,Aug
855,React Router Dynamic Pages,2017-08-08,21416,200,18,Aug
856,Material UI Table in React,2017-08-07,56585,303,57,Aug
857,Counting Votes with Subqueries,2017-08-07,350,5,0,Aug
858,GraphQL Pagination with Join Monster,2017-08-06,1111,12,33,Aug
859,GraphQL Join Monster Tutorial,2017-08-05,2928,25,29,Aug
860,Redux Saga and React Router v4,2017-08-04,8192,87,19,Aug
861,React Router v4 Tutorial,2017-08-03,61014,613,77,Aug
862,Environment Variables in Node.js,2017-08-02,21636,222,23,Aug
863,Build a Super Simple GraphQL Server in Flask with Graphene,2017-08-01,19401,207,36,Aug
864,Join Monster - Query Batching for SQL and GraphQL,2017-07-31,2346,28,20,Jul
865,Flexboxgrid with GraphQL,2017-07-31,634,11,2,Jul
866,GraphQL Cursor Pagination in React Native,2017-07-30,2612,29,8,Jul
867,GraphQL Pagination in React Native,2017-07-29,2388,27,16,Jul
868,Simple Pagination in GraphQL with Node.js and Postgresql,2017-07-28,8004,67,33,Jul
869,React Native Infinite Scroll,2017-07-27,19648,215,97,Jul
870,Style React Native List,2017-07-26,14773,90,8,Jul
871,React Native Fetch Data From API and Render FlatList,2017-07-25,59646,433,130,Jul
872,Edit Auction - Silent Auction React Native App Part 35,2017-07-24,873,9,8,Jul
873,"Register, Login, and Join Monster",2017-07-24,1896,17,10,Jul
874,Delete Auction - Silent Auction React Native App Part 34,2017-07-23,397,12,3,Jul
875,Testing React Components,2017-07-22,4567,45,5,Jul
876,React Form Client Side Validation,2017-07-21,55582,483,129,Jul
877,React Material Design Form,2017-07-20,25000,161,14,Jul
878,React and GraphQL on the same server,2017-07-19,1115,20,3,Jul
879,React and Feathersjs on the same server,2017-07-18,986,18,14,Jul
880,My Thoughts On Server-Side Rendering,2017-07-17,1592,41,30,Jul
881,Setting up GraphQL server and Create React App,2017-07-17,6341,53,20,Jul
882,Live Coding on Twitch.tv,2017-07-16,1354,18,9,Jul
883,Airbnb Eslint for React,2017-07-16,25862,314,40,Jul
884,How to code a form in React,2017-07-15,95112,1392,156,Jul
885,React Automatically Refresh Tokens,2017-07-14,52698,291,47,Jul
886,React Client Side Authentication,2017-07-13,88235,697,101,Jul
887,Create React App Login Form,2017-07-12,76575,245,55,Jul
888,Create React App Register Form Tutorial,2017-07-11,40397,211,60,Jul
889,I try to do a Login page in Next.js,2017-07-10,7511,29,13,Jul
890,Next.js Register User,2017-07-09,8176,44,11,Jul
891,LocalStorage Next.js,2017-07-08,10037,79,8,Jul
892,Facebook OAuth Next.js,2017-07-07,5549,35,21,Jul
893,How to store a Facebook OAuth user in PostgreSQL,2017-07-06,3032,45,11,Jul
894,Facebook OAuth GraphQL with Node.js,2017-07-05,9589,119,39,Jul
895,What is ngrok?,2017-07-04,39482,531,31,Jul
896,GraphQL DataLoader with Node.js,2017-07-03,7232,163,40,Jul
897,Refresh Tokens in GraphQL with Node.js,2017-07-02,3854,76,58,Jul
898,GraphQL Permissions with Node.js,2017-07-01,3427,76,37,Jul
899,Nextjs GraphQL Subscriptions,2017-06-30,2938,34,10,Jun
900,GraphQL Subscriptions with ReactQL,2017-06-29,785,15,6,Jun
901,How to setup GraphQL Subscriptions Nodejs,2017-06-28,9042,146,29,Jun
902,What is a GraphQL Subscription?,2017-06-27,3578,57,7,Jun
903,How to Install Javascript Code from GitHub,2017-06-26,18768,143,11,Jun
904,Nextjs GraphQL,2017-06-25,7004,92,27,Jun
905,Installing Nextjs,2017-06-24,6492,50,11,Jun
906,How to do a Persisted Query in GraphQL,2017-06-23,1599,16,17,Jun
907,GraphQL Authentication with Node.js,2017-06-21,24499,430,135,Jun
908,Is Persist GraphQL useful?,2017-06-21,286,2,4,Jun
909,Optimistic UI in React GraphQL Starter Kit,2017-06-20,1416,32,3,Jun
910,Variable Mutations in React GraphQL Starter Kit,2017-06-19,1644,15,0,Jun
911,Mutations in React GraphQL Starter Kit,2017-06-18,789,12,6,Jun
912,Connect Server to React GraphQL Starter Kit,2017-06-17,1047,10,7,Jun
913,Nesting GraphQL,2017-06-16,5806,59,24,Jun
914,I try to do associations in sequelize,2017-06-15,33416,234,37,Jun
915,Build a GraphQL Server with Node.js,2017-06-14,19340,233,43,Jun
916,Visual Studio Code React,2017-06-13,35479,68,22,Jun
917,Installing React GraphQL Starter Kit,2017-06-12,2700,21,7,Jun
918,How to Automatically Restart Node.js Server,2017-06-11,12253,71,14,Jun
919,My Neovim Configuration,2017-06-10,94903,767,64,Jun
920,Silent Auction Architecture,2017-06-09,233,5,2,Jun
921,Fullstack Feathersjs and React Web App Updated - part 31,2017-06-08,2080,11,8,Jun
922,Fullstack Feathersjs and React Web App Updated - part 30,2017-06-07,514,2,0,Jun
923,Fullstack Feathersjs and React Web App Updated - part 29,2017-06-06,222,2,0,Jun
924,Fullstack Feathersjs and React Web App Updated - part 28,2017-06-05,283,4,0,Jun
925,Fullstack Feathersjs and React Web App Updated - part 27,2017-06-04,366,4,0,Jun
926,Fullstack Feathersjs and React Web App Updated - part 26,2017-06-03,426,5,0,Jun
927,Fullstack Feathersjs and React Web App Updated - part 25,2017-06-02,415,6,0,Jun
928,Fullstack Feathersjs and React Web App Updated - part 24,2017-06-01,544,3,0,Jun
929,Fullstack Feathersjs and React Web App Updated - part 23,2017-05-31,360,3,0,May
930,Fullstack Feathersjs and React Web App Updated - part 22,2017-05-30,329,2,0,May
931,Fullstack Feathersjs and React Web App Updated - part 21,2017-05-29,323,4,6,May
932,What am I working on?,2017-05-29,1611,12,4,May
933,Fullstack Feathersjs and React Web App Updated - part 20,2017-05-28,274,1,0,May
934,Fullstack Feathersjs and React Web App Updated - part 19,2017-05-27,282,2,0,May
935,Fullstack Feathersjs and React Web App Updated - part 18,2017-05-26,498,3,4,May
936,Fullstack Feathersjs and React Web App Updated - part 17,2017-05-25,326,4,0,May
937,Fullstack Feathersjs and React Web App Updated - part 16,2017-05-24,293,2,0,May
938,Fullstack Feathersjs and React Web App Updated - part 15,2017-05-23,319,3,0,May
939,Fullstack Feathersjs and React Web App Updated - part 14,2017-05-22,365,2,0,May
940,Fullstack Feathersjs and React Web App Updated - part 13,2017-05-21,448,7,0,May
941,Fullstack Feathersjs and React Web App Updated - part 12,2017-05-20,916,11,6,May
942,Silent Auction React Native App,2017-05-19,9429,80,26,May
943,React Native Tutorial - Silent Auction App Part 33,2017-05-18,297,3,0,May
944,React Native Tutorial - Silent Auction App Part 32,2017-05-17,180,5,2,May
945,React Native Tutorial - Silent Auction App Part 31,2017-05-16,172,3,0,May
946,React Native Tutorial - Silent Auction App Part 30,2017-05-15,165,2,4,May
947,React Native Tutorial - Silent Auction App Part 29,2017-05-14,184,4,4,May
948,React Native Tutorial - Silent Auction App Part 28,2017-05-13,168,4,2,May
949,React Native Tutorial - Silent Auction App Part 27,2017-05-12,149,4,0,May
950,React Native Tutorial - Silent Auction App Part 26,2017-05-11,171,4,2,May
951,React Native Tutorial - Silent Auction App Part 25,2017-05-10,281,5,2,May
952,Deploy React Web App to Vultr,2017-05-10,5561,119,36,May
953,React Native Tutorial - Silent Auction App Part 24,2017-05-09,159,7,0,May
954,React Native Tutorial - Silent Auction App Part 23,2017-05-08,247,4,0,May
955,React Native Tutorial - Silent Auction App Part 22,2017-05-07,147,4,0,May
956,React Native Tutorial - Silent Auction App Part 21,2017-05-06,169,3,0,May
957,React Native Tutorial - Silent Auction App Part 20,2017-05-05,216,5,2,May
958,React Native Tutorial - Silent Auction App Part 19,2017-05-04,171,3,5,May
959,React Native Tutorial - Silent Auction App Part 18,2017-05-03,178,3,0,May
960,React Native Tutorial - Silent Auction App Part 17,2017-05-02,145,5,0,May
961,React Native Tutorial - Silent Auction App Part 16,2017-05-01,213,6,4,May
962,React Native Tutorial - Silent Auction App Part 15,2017-04-30,671,8,0,Apr
963,React Native Tutorial - Silent Auction App Part 14,2017-04-30,173,3,1,Apr
964,Feathersjs Paging,2017-04-30,1608,24,11,Apr
965,React Native Tutorial - Silent Auction App Part 13,2017-04-29,202,4,0,Apr
966,React Native Tutorial - Silent Auction App Part 12,2017-04-28,244,6,18,Apr
967,React Native Tutorial - Silent Auction App Part 11,2017-04-27,998,9,6,Apr
968,React Native Tutorial - Silent Auction App Part 10,2017-04-26,299,4,0,Apr
969,React Native Tutorial - Silent Auction App Part 9,2017-04-25,360,5,0,Apr
970,React Native Tutorial - Silent Auction App Part 8,2017-04-24,452,5,5,Apr
971,React Native Tutorial - Silent Auction App Part 7,2017-04-23,673,8,17,Apr
972,React Native Tutorial - Silent Auction App Part 6,2017-04-22,938,9,10,Apr
973,React Native Tutorial - Silent Auction App Part 5,2017-04-21,744,15,9,Apr
974,React Native Tutorial - Silent Auction App Part 4,2017-04-20,912,11,5,Apr
975,How I got a Software Engineering Internship at Bank of America,2017-04-20,15203,440,52,Apr
976,React Native Tutorial - Silent Auction App Part 3,2017-04-19,790,13,2,Apr
977,React Native Tutorial - Silent Auction App Part 2,2017-04-18,1312,16,13,Apr
978,React Native Tutorial - Silent Auction App Part 1,2017-04-17,3813,37,55,Apr
979,React Native Tutorial - Silent Auction App Part 0,2017-04-16,3494,35,3,Apr
980,React Native Redux Tutorial,2017-04-12,7262,50,3,Apr
981,React Native Navigation,2017-04-12,5715,39,28,Apr
982,React Native Setup,2017-04-12,3684,30,5,Apr
983,Setting up Redux Form and Redux Observable,2017-04-10,927,9,1,Apr
984,Redux Form Submit To Server With Redux Observable,2017-04-10,3695,40,16,Apr
985,Redux Form Submit To Server With Redux Saga,2017-03-30,6354,54,10,Mar
986,Updating My React Template,2017-03-30,536,3,2,Mar
987,Redux Form Submit To Server With Redux Saga - Part 2,2017-03-30,1648,22,12,Mar
988,Redux Form Tutorial,2017-03-30,33224,293,30,Mar
989,Redux Form Submit To Server Using Fetch,2017-03-30,7395,57,6,Mar
990,Feathersjs Many to Many Relationship PostgreSQL,2017-03-30,3494,31,2,Mar
991,Feathersjs 1 to N Relationship with PostgreSQL,2017-03-29,1987,21,23,Mar
992,Feathersjs 1 to 1 Relationship with PostgreSQL,2017-03-29,982,15,0,Mar
993,React Native To Do List App Using GraphQL,2017-03-29,5195,30,1,Mar
994,React Native To Do List App - part 11,2017-03-22,1333,14,2,Mar
995,React Native To Do List App - part 10,2017-03-20,367,2,0,Mar
996,React Native To Do List App - part 9,2017-03-19,321,2,0,Mar
997,React Native To Do List App - part 8,2017-03-19,247,2,0,Mar
998,React Native To Do List App - part 7,2017-03-19,232,3,0,Mar
999,React Native To Do List App - part 6,2017-03-17,285,4,0,Mar
1000,React Native To Do List App - part 5,2017-03-17,322,3,0,Mar
1001,React Native To Do List App - part 4,2017-03-16,347,6,0,Mar
1002,React Native To Do List App - part 3,2017-03-16,520,7,0,Mar
1003,React Native To Do List App - part 2,2017-03-14,772,6,0,Mar
1004,React Native To Do List App - part 1,2017-03-13,4047,20,2,Mar
1005,React Native To Do List App - part 0,2017-03-13,4309,23,7,Mar
1006,I'll build you an app for free,2017-03-09,630,10,36,Mar
1007,Basic React with redux-observable,2017-02-27,19268,171,25,Feb
1008,React GraphQL with Apollo part 7,2017-02-25,590,5,5,Feb
1009,React GraphQL with Apollo part 4,2017-02-25,722,2,1,Feb
1010,React GraphQL with Apollo part 5,2017-02-25,478,5,0,Feb
1011,React GraphQL with Apollo part 8,2017-02-25,487,6,1,Feb
1012,React GraphQL with Apollo part 3,2017-02-25,893,10,1,Feb
1013,React GraphQL with Apollo part 6,2017-02-25,412,2,2,Feb
1014,React GraphQL with Apollo part 1,2017-02-25,4705,36,10,Feb
1015,React GraphQL with Apollo part 2,2017-02-25,1252,10,7,Feb
1016,React GraphQL with Apollo part 0,2017-02-25,4191,27,4,Feb
1017,GraphQL Authentication with Feathersjs,2017-01-08,4614,53,36,Jan
1018,GraphQL setup with Feathersjs,2017-01-04,10451,103,26,Jan
1019,Redux saga tutorial,2017-01-02,37858,189,52,Jan
1020,Finish redux-form and redux-saga web app,2017-01-02,2831,45,7,Jan
1021,Basic redux-form,2017-01-02,27678,145,39,Jan
1022,How to use redux-form and redux-saga,2017-01-02,10445,54,15,Jan
1023,Redux Reducer,2016-12-30,1612,20,6,Dec
1024,Create Layout using React and Semantic UI,2016-12-30,47573,132,21,Dec
1025,Use Feathersjs Client to Call API,2016-12-30,1928,12,0,Dec
1026,Create Sagas with Redux-Saga,2016-12-30,5591,23,3,Dec
1027,Setup Frontend,2016-12-30,2040,17,3,Dec
1028,Setting up Feathersjs Server with PostgreSQL and Socket.IO,2016-12-30,6553,39,8,Dec
1029,Real-time React Todo List Web App with Feathersjs,2016-12-30,10457,82,1,Dec
1030,Basic Real-time Web App using React and Feathersjs,2016-12-29,11415,85,7,Dec
1031,Learn terminal part 13,2016-12-21,742,4,0,Dec
1032,Learn terminal part 12,2016-12-21,451,4,1,Dec
1033,Learn terminal part 11,2016-12-21,428,6,1,Dec
1034,Learn terminal part 10,2016-12-21,465,7,4,Dec
1035,Learn terminal part 8,2016-12-21,414,6,6,Dec
1036,Learn terminal part 7,2016-12-21,500,8,4,Dec
1037,Learn terminal part 6,2016-12-21,480,7,1,Dec
1038,Learn terminal part 5,2016-12-21,541,6,0,Dec
1039,Learn terminal part 4,2016-12-21,638,13,0,Dec
1040,Learn terminal part 3,2016-12-20,782,10,10,Dec
1041,Learn terminal part 2,2016-12-20,990,16,1,Dec
1042,Learn terminal part 1,2016-12-20,2202,33,1,Dec
1043,Why learn terminal or the command line??,2016-12-20,7279,115,61,Dec
1044,Setup Feathersjs with PostgreSQL on Mac,2016-12-20,556,7,3,Dec
1045,Building a Food Android App - part 7,2016-12-18,4004,17,5,Dec
1046,Building a Food Android App - part 6,2016-12-18,2628,8,1,Dec
1047,Building a Food Android App - part 5,2016-12-17,2476,10,0,Dec
1048,Building a Food Android App - part 4,2016-12-17,4755,10,0,Dec
1049,Building a Food Android App - part 3,2016-12-17,4592,17,3,Dec
1050,Building a Food Android App - part 2,2016-12-17,9956,38,4,Dec
1051,Building a Food Android App - part 1,2016-12-16,21972,109,12,Dec
1052,Building a Food Android App,2016-12-16,5485,30,4,Dec
1053,Android Food Tinder App,2016-12-15,749,9,1,Dec
1054,Fullstack Feathersjs and React Web App - part 11,2016-12-02,1352,25,32,Dec
1055,Fullstack Feathersjs and React Web App - part 10,2016-12-02,856,8,2,Dec
1056,Fullstack Feathersjs and React Web App - part 9,2016-12-01,924,11,0,Dec
1057,Fullstack Feathersjs and React Web App - part 8,2016-12-01,1023,11,0,Dec
1058,Fullstack Feathersjs and React Web App - part 7,2016-12-01,1260,12,8,Dec
1059,Fullstack Feathersjs and React Web App - part 6,2016-12-01,1353,10,7,Dec
1060,Fullstack Feathersjs and React Web App - part 5,2016-12-01,1614,16,0,Dec
1061,Fullstack Feathersjs and React Web App - part 4,2016-11-30,2338,15,9,Nov
1062,Fullstack Feathersjs and React Web App - part 2,2016-11-30,10612,60,43,Nov
1063,Fullstack Feathersjs and React Web App - part 3,2016-11-30,2954,17,14,Nov
1064,Fullstack Feathersjs and React Web App - part 1,2016-11-28,19846,118,46,Nov
1065,Fullstack Feathersjs and React Web App - part 0,2016-11-28,5118,41,5,Nov
1066,Gradient Descent Implemented in Python,2016-07-03,29741,223,20,Jul
1067,HOW TO SETUP A LOCAL WORDPRESS WEBSITE,2015-07-20,276,5,3,Jul
1068,Updated LoL Scout - Promo,2015-07-10,572,5,5,Jul
1069,LoL Python Bot,2015-05-08,14355,45,7,May
1070,How to delete a note from the database,2015-05-05,162,4,2,May
1071,Coding an Android To Do List App - Part 3.5,2015-05-03,2335,6,1,May
1072,Coding an Android To Do List App - Part 16,2015-04-26,3081,13,4,Apr
1073,Kotlin Hello World,2015-04-26,349,3,1,Apr
1074,Coding an Android To Do List App - Part 15,2015-04-21,1307,5,0,Apr
1075,Coding an Android To Do List App - Part 14,2015-04-16,769,2,0,Apr
1076,Coding an Android To Do List App - Part 13,2015-04-15,628,2,0,Apr
1077,Coding an Android To Do List App - Part 12,2015-04-15,654,2,0,Apr
1078,Drag and Drog ListView Bug 2,2015-04-15,266,3,0,Apr
1079,Coding an Android To Do List App - Part 11,2015-04-12,892,4,0,Apr
1080,Coding an Android To Do List App - Part 10,2015-04-10,679,2,1,Apr
1081,Coding an Android To Do List App - Part 9,2015-04-09,969,4,1,Apr
1082,Dynamic ListView Bug,2015-04-09,254,3,1,Apr
1083,Coding an Android To Do List App - Part 8,2015-04-08,1131,4,1,Apr
1084,Coding an Android To Do List App - Part 6,2015-04-07,1220,3,0,Apr
1085,Coding an Android To Do List App - Part 7,2015-04-07,917,3,1,Apr
1086,Coding an Android To Do List App - Part 5,2015-04-06,1822,8,2,Apr
1087,Coding an Android To Do List App - Part 4,2015-04-03,1504,10,6,Apr
1088,Coding an Android To Do List App - Part 3,2015-03-29,2895,11,2,Mar
1089,Coding an Android To Do List App - Part 2,2015-03-27,6217,27,5,Mar
1090,Building a To Do List Android App,2015-03-26,32687,132,28,Mar
1091,Stack Calculator - Promo Updated,2015-03-24,354,6,0,Mar
1092,LoL Scout - Promo,2015-03-23,1696,14,7,Mar
1093,Behind The Scenes Look at Stack Calculator,2015-03-17,2788,26,5,Mar
1094,How to use an RPN calculator,2015-03-17,11929,110,35,Mar
1095,Stack Calculator - Promo,2015-03-13,6418,97,22,Mar
